{
  "schema_version": "xir-lab-native-ablation-v1-operational-incidents",
  "namespace": "native-ablation-v1",
  "incidents": [
    {
      "incident_id": "scale-rpc-poll-internal-error-001",
      "phase": "scale",
      "observed_at_utc": "2026-08-07T04:43:05.048Z",
      "runner_pid": 1369656,
      "resume_pid": 1377795,
      "completed_attempts_before_exit": 2367,
      "affected_attempt_id": "ablv1_375b4445615713725d821c0228d31a56",
      "route": "LH",
      "layer": "B1",
      "route_sequence": 295,
      "operation": "destination consumedAttempts eth_call poll",
      "exception_class": "Web3RPCError",
      "exception_code": -32603,
      "exception_message": "Internal error",
      "read_only_rpc_failure": true,
      "native_hops_committed": 2,
      "destination_effect_observed_before_resume": true,
      "committed_stage_summary": [
        "first-hop native ingress authenticated",
        "second-hop native ingress authenticated",
        "destination application effect committed"
      ],
      "recovery": "same plan, database, raw root, deployment, and frozen configuration",
      "polling_change": "retry transient Web3RPCError during read-only evidence and effect polling",
      "treatment_changed": false,
      "status": "recovered",
      "attempt_in_final_denominator": true,
      "runner_log_relative_path": "runs/scale/runner.log",
      "runner_log_sha256": "cbe47fb4718e7c2d9a1f21a2864c36ba999d37133be7896dcb27b30056538247",
      "resume_source_relative_path": "operational-source-snapshots/ablation_v1-before-entry-read-retry.py",
      "resume_source_sha256": "2f75f9724a3747d879b9836ab53557275ed6dcf893131e43c19e4e5005c3c337"
    },
    {
      "incident_id": "scale-rpc-poll-internal-error-002",
      "phase": "scale",
      "observed_at_utc": "2026-08-07T05:25:02.108Z",
      "runner_pid": 1377795,
      "resume_pid": 1385772,
      "completed_attempts_before_exit": 4831,
      "affected_attempt_id": "ablv1_0dd3f7106536e26df3a503d3111c827a",
      "route": "LH",
      "layer": "B1",
      "route_sequence": 602,
      "operation": "first-hop ingress status eth_call poll",
      "exception_class": "Web3RPCError",
      "exception_code": -32603,
      "exception_message": "Internal error",
      "read_only_rpc_failure": true,
      "native_hops_committed": 1,
      "destination_effect_observed_before_resume": false,
      "committed_stage_summary": [
        "logical record transaction committed",
        "source dispatch transaction committed",
        "first-hop native ingress authenticated"
      ],
      "recovery": "same plan, database, raw root, deployment, and frozen configuration",
      "polling_change": "retry transient Web3RPCError and -32603 Internal error at the entry-level read-only status poll",
      "treatment_changed": false,
      "status": "recovered",
      "attempt_in_final_denominator": true,
      "runner_log_relative_path": "runs/scale/runner-resume-1.log",
      "runner_log_sha256": "f64cc4b71adba0511bf1e807e7aef5e52f21ec72cabe0761dd039c416c84498c",
      "pre_retry_source_relative_path": "operational-source-snapshots/ablation_v1-before-entry-read-retry.py",
      "pre_retry_source_sha256": "2f75f9724a3747d879b9836ab53557275ed6dcf893131e43c19e4e5005c3c337",
      "resume_source_relative_path": "operational-source-snapshots/ablation_v1-resume-2-entry-read-retry.py",
      "resume_source_sha256": "76c51482758da2cf3df014889b1db8182158eda73921f1dbd09c7bd4f0c98c93"
    }
  ],
  "latency_sensitivity": {
    "phase": "scale",
    "rule_id": "exclude-complete-incident-route-sequence-blocks-v1",
    "selection_unit": "deterministic_interleave_block",
    "excluded_route_sequences": [295, 602],
    "exclusion_reason": "process interruption overlapped the matched deterministic interleave block",
    "full_matched_blocks": 1000,
    "expected_included_blocks": 998,
    "expected_excluded_blocks": 2,
    "expected_included_attempts": 7984,
    "expected_excluded_attempts": 16,
    "expected_included_per_cell": 998,
    "ordering": "retain ascending route_sequence order within each route and layer",
    "interval_method": "paired moving-block bootstrap with the frozen experiment parameters"
  }
}
